{
  "layoutId": "layout.hero-and-grid",
  "version": "0.1.0",
  "displayName": "Hero + Grid",
  "description": "A full-width hero at the top with a two-up grid below.",
  "grid": { "columns": 12, "rowHeight": 160, "gap": 16 },
  "slots": [
    { "name": "hero", "col": 1, "row": 1, "colSpan": 12, "rowSpan": 2 },
    { "name": "grid", "col": 1, "row": 3, "colSpan": 12, "rowSpan": 2 }
  ]
}
