{
  "layoutId": "layout.dashboard-tiles",
  "version": "0.1.0",
  "displayName": "Dashboard Tiles",
  "description": "A single wide slot for a tile/metric widget.",
  "grid": { "columns": 12, "rowHeight": 160, "gap": 16 },
  "slots": [
    { "name": "tiles", "col": 1, "row": 1, "colSpan": 12, "rowSpan": 2 }
  ]
}
